{
  "$schema": "../../schemas/case-bundle.schema.json",
  "contract_version": 1,
  "kind": "validation",
  "defaults": {
    "input": {
      "now":"2026-07-20T12:00:00Z","horizon":{"start":"2026-07-01T00:00:00Z","end":"2026-08-01T00:00:00Z"},"candidate_projection_ref":"projection-validation",
      "policy":{"policy_ref":"policy-validation","revision":1,"state":"active","source_calendar_ref":"calendar-source","destination_calendar_ref":"calendar-destination","hours":{"mode":"all_times"},"privacy":{"preset":"busy_only","preset_version":1,"generic_summary":"Busy","copy_summary":false,"copy_description":false,"copy_location":false,"copy_conference":false,"copy_attendees":false,"copy_organizer":false},"selection":{"timed":"include","all_day":"skip","free_events":"skip_when_redacted","tentative":"busy","unanswered":"free","skip_when_destination_identity_invited":true,"source_exclusion_marker":"#nosync","manual_exclusions":[]},"destination":{}},
      "source":{"source_event_ref":"source-validation","source_occurrence_ref":"source-validation/occurrence","remote_revision":"r1","lifecycle":"confirmed","origin":"provider_original","timing":{"kind":"timed","start_instant":"2026-07-20T17:00:00Z","end_instant":"2026-07-20T18:00:00Z","start_tzid":"America/Vancouver","end_tzid":"America/Vancouver"},"availability":"busy","relationship":{"role":"none","response":"not_applicable"},"destination_identity_invited":false,"content":{"summary":"Title"}},
      "projection":{"ownership":"none"},
      "destination_capabilities":{"writable":true,"private_visibility":true,"conference_copy":true,"color":true}
    }
  },
  "cases": [
    {"case_id":"validation.same_calendar","title":"Source and destination calendar cannot match","requirements":["CAL-009","CAL-013","MAC-012"],"input_patch":{"policy":{"destination_calendar_ref":"calendar-source"}},"expected":{"selection":"invalid","operation":"none","primary_reason_code":"invalid_same_calendar"}},
    {"case_id":"validation.unwritable_destination","title":"Destination must be writable","requirements":["CAL-009","MAC-012"],"input_patch":{"destination_capabilities":{"writable":false}},"expected":{"selection":"invalid","operation":"none","primary_reason_code":"invalid_unwritable_destination"}},
    {"case_id":"validation.attendee_copy_rejected","title":"Attendee copying is rejected in v1","requirements":["CAL-011","CAL-013","MAC-012"],"input_patch":{"policy":{"privacy":{"copy_attendees":true}}},"expected":{"selection":"invalid","operation":"none","primary_reason_code":"invalid_privacy_transform"}},
    {"case_id":"validation.organizer_copy_rejected","title":"Organizer copying is rejected in v1","requirements":["CAL-011","CAL-013","MAC-012"],"input_patch":{"policy":{"privacy":{"copy_organizer":true}}},"expected":{"selection":"invalid","operation":"none","primary_reason_code":"invalid_privacy_transform"}},
    {"case_id":"validation.redacted_switch_rejected","title":"Redacted preset cannot enable source detail switches","requirements":["CAL-011","MAC-012"],"input_patch":{"policy":{"privacy":{"copy_summary":true}}},"expected":{"selection":"invalid","operation":"none","primary_reason_code":"invalid_privacy_transform"}},
    {"case_id":"validation.empty_generic_summary","title":"Generic summary cannot be empty","requirements":["CAL-011","MAC-012"],"input_patch":{"policy":{"privacy":{"generic_summary":"   "}}},"expected":{"selection":"invalid","operation":"none","primary_reason_code":"invalid_privacy_transform"}},
    {"case_id":"validation.private_visibility_unsupported","title":"Private preset requires private visibility capability","requirements":["CAL-011","MAC-012"],"input_patch":{"destination_capabilities":{"private_visibility":false}},"expected":{"selection":"invalid","operation":"none","primary_reason_code":"unsupported_destination_capability"}},
    {"case_id":"validation.conference_copy_unsupported","title":"Conference field switch requires destination capability","requirements":["CAL-011","MAC-012"],"input_patch":{"policy":{"privacy":{"preset":"shared_details","copy_conference":true}},"destination_capabilities":{"conference_copy":false}},"expected":{"selection":"invalid","operation":"none","primary_reason_code":"unsupported_destination_capability"}},
    {"case_id":"validation.color_unsupported","title":"Color override requires destination capability","requirements":["CAL-011","MAC-012"],"input_patch":{"policy":{"destination":{"color":"color-7"}},"destination_capabilities":{"color":false}},"expected":{"selection":"invalid","operation":"none","primary_reason_code":"unsupported_destination_capability"}},
    {"case_id":"validation.missing_confirmed_timing","title":"Confirmed source observation requires timing","requirements":["CAL-012","MAC-012"],"input_patch":{"source":{"timing":null}},"expected":{"selection":"invalid","operation":"none","primary_reason_code":"invalid_source_event"}},
    {"case_id":"validation.hours_profile_reference_mismatch","title":"Policy and profile references must match","requirements":["CAL-010","MAC-012"],"input_patch":{"policy":{"hours":{"mode":"overlaps_profile","profile_ref":"wanted-profile"}},"hours_profile":{"profile_ref":"different-profile","revision":1,"timezone":"UTC","dst_resolution":{"ambiguous":"earlier_offset","nonexistent":"reject"},"weekly":[],"exceptions":[]}},"expected":{"selection":"invalid","operation":"none","primary_reason_code":"invalid_hours_profile"}}
  ]
}
