{
  "$schema": "../../schemas/case-bundle.schema.json",
  "contract_version": 1,
  "kind": "policy_evaluation",
  "defaults": {
    "input": {
      "now":"2026-07-20T12:00:00Z","horizon":{"start":"2026-07-01T00:00:00Z","end":"2026-08-01T00:00:00Z"},"candidate_projection_ref":"projection-new",
      "policy":{"policy_ref":"policy-reconcile","revision":1,"state":"active","source_calendar_ref":"calendar-source","destination_calendar_ref":"calendar-destination","hours":{"mode":"all_times"},"privacy":{"preset":"busy_only","preset_version":1,"generic_summary":"Busy","copy_summary":false,"copy_description":false,"copy_location":false,"copy_conference":false,"copy_attendees":false,"copy_organizer":false},"selection":{"timed":"include","all_day":"skip","free_events":"skip_when_redacted","tentative":"busy","unanswered":"free","skip_when_destination_identity_invited":true,"source_exclusion_marker":"#nosync","manual_exclusions":[]},"destination":{}},
      "source":{"source_event_ref":"source-reconcile","source_occurrence_ref":"source-reconcile/occurrence","remote_revision":"r2","lifecycle":"confirmed","origin":"provider_original","timing":{"kind":"timed","start_instant":"2026-07-20T17:00:00Z","end_instant":"2026-07-20T18:00:00Z","start_tzid":"America/Vancouver","end_tzid":"America/Vancouver"},"availability":"busy","relationship":{"role":"none","response":"not_applicable"},"destination_identity_invited":false,"content":{"summary":"Private source title"}},
      "projection":{"ownership":"attached","projection_ref":"projection-existing","generation":2,"destination_event_ref":"destination-event","destination_exists":true,"observed_copy":{"timing":{"kind":"timed","start_instant":"2026-07-20T17:00:00Z","end_instant":"2026-07-20T18:00:00Z","start_tzid":"America/Vancouver","end_tzid":"America/Vancouver"},"summary":"Busy","transparency":"opaque","visibility":"private","reminders":[],"write_controls":{"send_notifications":false},"provenance":{"version":1,"policy_ref":"policy-reconcile","projection_ref":"projection-existing","generation":2}}},
      "destination_capabilities":{"writable":true,"private_visibility":true,"conference_copy":true,"color":true}
    }
  },
  "cases": [
    {"case_id":"reconcile.identical_no_change","title":"Exact managed state is a no-op","requirements":["CAL-013","MAC-012"],"input_patch":{},"expected":{"selection":"included","operation":"none","primary_reason_code":"no_change"}},
    {"case_id":"reconcile.source_deleted","title":"Source deletion removes attached copy","requirements":["CAL-012","CAL-013","MAC-012"],"input_patch":{"source":{"lifecycle":"deleted"}},"expected":{"selection":"excluded","operation":"delete","primary_reason_code":"delete_source_removed","reason_codes_include":["source_deleted"]}},
    {"case_id":"reconcile.source_cancelled","title":"Source cancellation removes attached copy","requirements":["CAL-012","CAL-013","MAC-012"],"input_patch":{"source":{"lifecycle":"cancelled"}},"expected":{"selection":"excluded","operation":"delete","primary_reason_code":"delete_source_removed","reason_codes_include":["source_cancelled"]}},
    {"case_id":"reconcile.policy_exclusion_deletes","title":"New policy exclusion removes attached copy","requirements":["CAL-013","MAC-012"],"input_patch":{"policy":{"selection":{"manual_exclusions":["source-reconcile"]}}},"expected":{"selection":"excluded","operation":"delete","primary_reason_code":"delete_policy_exclusion","reason_codes_include":["manual_exclusion"]}},
    {"case_id":"reconcile.destination_missing_restored","title":"Externally deleted managed copy is recreated","requirements":["CAL-013","MAC-012"],"input_patch":{"projection":{"destination_exists":false,"observed_copy":null}},"expected":{"selection":"included","operation":"create","primary_reason_code":"restore_destination_missing"}},
    {"case_id":"reconcile.destination_drift_restored","title":"Managed destination-field drift is restored","requirements":["CAL-013","MAC-012"],"input_patch":{"projection":{"observed_copy":{"timing":{"kind":"timed","start_instant":"2026-07-20T17:00:00Z","end_instant":"2026-07-20T18:00:00Z","start_tzid":"America/Vancouver","end_tzid":"America/Vancouver"},"summary":"Edited destination title","transparency":"opaque","visibility":"private","reminders":[],"write_controls":{"send_notifications":false},"provenance":{"version":1,"policy_ref":"policy-reconcile","projection_ref":"projection-existing","generation":2}}}},"expected":{"selection":"included","operation":"update","primary_reason_code":"restore_destination_drift"}},
    {"case_id":"reconcile.detached_included_no_action","title":"Detached included copy is never restored","requirements":["CAL-013","MAC-012"],"input_patch":{"projection":{"ownership":"detached"}},"expected":{"selection":"included","operation":"none","primary_reason_code":"detached_no_action"}},
    {"case_id":"reconcile.detached_excluded_no_action","title":"Detached excluded copy is never deleted","requirements":["CAL-013","MAC-012"],"input_patch":{"projection":{"ownership":"detached"},"source":{"lifecycle":"deleted"}},"expected":{"selection":"excluded","operation":"none","primary_reason_code":"detached_no_action"}},
    {"case_id":"reconcile.ambiguous_ownership_hold","title":"Ambiguous ownership never writes","requirements":["CAL-013","MAC-011","MAC-012"],"input_patch":{"projection":{"ownership":"ambiguous"}},"expected":{"selection":"held","operation":"none","primary_reason_code":"ambiguous_ownership"}},
    {"case_id":"reconcile.paused_retains_copy","title":"Pause retains destination copies","requirements":["CAL-013","CAL-014","MAC-012"],"input_patch":{"policy":{"state":"paused"}},"expected":{"selection":"held","operation":"none","primary_reason_code":"policy_paused"}},
    {"case_id":"reconcile.disabled_no_implicit_cleanup","title":"Disabled policy does not implicitly delete copies","requirements":["CAL-013","MAC-012"],"input_patch":{"policy":{"state":"disabled"}},"expected":{"selection":"excluded","operation":"none","primary_reason_code":"policy_disabled"}},
    {"case_id":"reconcile.review_required_holds","title":"Review-required policy produces no writes","requirements":["CAL-013","MAC-011","MAC-012"],"input_patch":{"policy":{"state":"review_required"}},"expected":{"selection":"held","operation":"none","primary_reason_code":"policy_review_required"}},
    {"case_id":"reconcile.marker_only_not_ownership","title":"Managed marker prevents recursion but creates no ownership authority","requirements":["CAL-013","MAC-012"],"input_patch":{"source":{"origin":"planipus_managed"},"projection":{"ownership":"none","projection_ref":null,"generation":null,"destination_event_ref":null,"destination_exists":null,"observed_copy":null}},"expected":{"selection":"excluded","operation":"none","primary_reason_code":"managed_copy"}},
    {"case_id":"reconcile.remove_copy_requires_manual_exclusion","title":"Remove-copy state is represented by durable manual exclusion before delete","requirements":["CAL-013","MAC-012"],"input_patch":{"policy":{"selection":{"manual_exclusions":["source-reconcile"]}}},"expected":{"selection":"excluded","operation":"delete","primary_reason_code":"delete_policy_exclusion","reason_codes_include":["manual_exclusion"]}},
    {"case_id":"reconcile.redacted_title_change_no_write","title":"Changing a redacted source title does not change the managed copy","requirements":["CAL-011","CAL-013","MAC-012"],"input_patch":{"source":{"content":{"summary":"Entirely different private title"},"remote_revision":"r3"}},"expected":{"selection":"included","operation":"none","primary_reason_code":"no_change","forbidden_values":["Entirely different private title"]}},
    {"case_id":"reconcile.stricter_privacy_removes_fields","title":"Changing shared details to busy-only removes disclosed fields","requirements":["CAL-011","CAL-013","MAC-012"],"input_patch":{"projection":{"observed_copy":{"timing":{"kind":"timed","start_instant":"2026-07-20T17:00:00Z","end_instant":"2026-07-20T18:00:00Z","start_tzid":"America/Vancouver","end_tzid":"America/Vancouver"},"summary":"Private source title","description":"Previously shared","transparency":"opaque","visibility":"default","reminders":[],"write_controls":{"send_notifications":false},"provenance":{"version":1,"policy_ref":"policy-reconcile","projection_ref":"projection-existing","generation":2}}}},"expected":{"selection":"included","operation":"update","primary_reason_code":"restore_destination_drift","desired_fields":{"summary":"Busy","visibility":"private"},"desired_absent_fields":["description"]}}
  ]
}
